"16","3","Apa de Toaleta Hugo Boss Bottled Tonic","barbati","165","655","1","23","usertest100","","","","0","","","0","0","",""
"17","11","Apa de Parfum Calvin Klein Beauty","femei","110","1060","4","38","usertest2","","","","0","","","0","0","",""
"18","8","Apa de parfum Giorgio Armani Acqua Di Gio Profumo","barbati","330","1545","1","38","usertest2","","","","0","","","0","0","",""
"19","8","Apa de parfum Giorgio Armani Acqua Di Gio Profumo","barbati","330","1545","1","38","usertest2","","","","0","","","0","0","",""
"20","1","Apa de Toaleta Hugo Boss Bottled Night","barbati","155","155","1","37","usertest","","","","0","","","0","0","",""
"21","0","","","0","0","0","37","usertest","","","","0","","","0","0","",""
"22","1","Apa de Toaleta Hugo Boss Bottled Night","barbati","155","155","1","37","usertest","","","","0","","","0","0","",""
